<?xml version="1.0" encoding="UTF-8" ?>
<ifc:IFCPolicy xmlns:xsi="http://www.w3.org/2001/XMLSchema-instance"
               xsi:schemaLocation="http://ifcparaclete.org file:/Users/GripGlebe/jdeveloper/mywork/IFCParaclete/MaxineCode/src/org/ifcparaclete/IFCPolicy.xsd"
               xmlns:ifc="http://ifcparaclete.org">
    <ifc:IFCObjects>
        <ifc:ActorObjects>
            <ifc:ActorObject>
                <ifc:Name>com.sun.max.vm.run.java.JavaRunScheme</ifc:Name>
                <ifc:ID>0</ifc:ID>
                <ifc:SecurityLevel>F</ifc:SecurityLevel>
                <ifc:Category>S</ifc:Category>
                <ifc:Type>T</ifc:Type>
                <ifc:ActiveIFOPS>
                    <ifc:Op>e</ifc:Op>
                    <ifc:Op>o</ifc:Op>
                    <ifc:Op>c</ifc:Op>
                    <ifc:Op>l</ifc:Op>
                    <ifc:Op>w</ifc:Op>
                    <ifc:Op>r</ifc:Op>
                    <ifc:Op>d</ifc:Op>
                    <ifc:Op>f</ifc:Op>
                    <ifc:Op>a</ifc:Op>
                    <ifc:Op>m</ifc:Op>
                </ifc:ActiveIFOPS>
                <ifc:PassiveIFOPS>
                    <ifc:Op>e</ifc:Op>
                    <ifc:Op>o</ifc:Op>
                    <ifc:Op>c</ifc:Op>
                    <ifc:Op>l</ifc:Op>
                    <ifc:Op>w</ifc:Op>
                    <ifc:Op>r</ifc:Op>
                    <ifc:Op>d</ifc:Op>
                    <ifc:Op>f</ifc:Op>
                    <ifc:Op>a</ifc:Op>
                    <ifc:Op>m</ifc:Op>
                </ifc:PassiveIFOPS>
            </ifc:ActorObject>
            <ifc:ActorObject>
                <ifc:Name>com.sun.max.vm.hosted.HostedClassLoader</ifc:Name>
                <ifc:ID>1</ifc:ID>
                <ifc:SecurityLevel>F</ifc:SecurityLevel>
                <ifc:Category>S</ifc:Category>
                <ifc:Type>T</ifc:Type>
                <ifc:ActiveIFOPS>
                    <ifc:Op>e</ifc:Op>
                    <ifc:Op>o</ifc:Op>
                    <ifc:Op>c</ifc:Op>
                    <ifc:Op>l</ifc:Op>
                    <ifc:Op>w</ifc:Op>
                    <ifc:Op>r</ifc:Op>
                    <ifc:Op>d</ifc:Op>
                    <ifc:Op>f</ifc:Op>
                    <ifc:Op>a</ifc:Op>
                    <ifc:Op>m</ifc:Op>
                </ifc:ActiveIFOPS>
                <ifc:PassiveIFOPS>
                    <ifc:Op>e</ifc:Op>
                    <ifc:Op>o</ifc:Op>
                    <ifc:Op>c</ifc:Op>
                    <ifc:Op>l</ifc:Op>
                    <ifc:Op>w</ifc:Op>
                    <ifc:Op>r</ifc:Op>
                    <ifc:Op>d</ifc:Op>
                    <ifc:Op>f</ifc:Op>
                    <ifc:Op>a</ifc:Op>
                    <ifc:Op>m</ifc:Op>
                </ifc:PassiveIFOPS>
            </ifc:ActorObject>
            <ifc:ActorObject>
                <ifc:Name>test.output.HelloWorld</ifc:Name>
                <ifc:ID>2</ifc:ID>
                <ifc:SecurityLevel>F</ifc:SecurityLevel>
                <ifc:Category>A</ifc:Category>
                <ifc:Type>I</ifc:Type>
                <ifc:ActiveIFOPS/>
                <ifc:PassiveIFOPS>
                    <ifc:Op>e</ifc:Op>
                    <ifc:Op>o</ifc:Op>
                    <ifc:Op>c</ifc:Op>
                    <ifc:Op>l</ifc:Op>
                    <ifc:Op>w</ifc:Op>
                    <ifc:Op>r</ifc:Op>
                    <ifc:Op>d</ifc:Op>
                    <ifc:Op>f</ifc:Op>
                    <ifc:Op>a</ifc:Op>
                    <ifc:Op>m</ifc:Op>
                </ifc:PassiveIFOPS>
            </ifc:ActorObject>
        </ifc:ActorObjects>
        <ifc:TargetObjects>
            <ifc:TargetObject>
                <ifc:Name>com.sun.max.vm.run.java.JavaRunScheme</ifc:Name>
                <ifc:ID>0</ifc:ID>
                <ifc:SecurityLevel>F</ifc:SecurityLevel>
                <ifc:Category>S</ifc:Category>
                <ifc:Type>T</ifc:Type>
                <ifc:ActiveIFOPS>
                    <ifc:Op>e</ifc:Op>
                    <ifc:Op>o</ifc:Op>
                    <ifc:Op>c</ifc:Op>
                    <ifc:Op>l</ifc:Op>
                    <ifc:Op>w</ifc:Op>
                    <ifc:Op>r</ifc:Op>
                    <ifc:Op>d</ifc:Op>
                    <ifc:Op>f</ifc:Op>
                    <ifc:Op>a</ifc:Op>
                    <ifc:Op>m</ifc:Op>
                </ifc:ActiveIFOPS>
                <ifc:PassiveIFOPS>
                    <ifc:Op>e</ifc:Op>
                    <ifc:Op>o</ifc:Op>
                    <ifc:Op>c</ifc:Op>
                    <ifc:Op>l</ifc:Op>
                    <ifc:Op>w</ifc:Op>
                    <ifc:Op>r</ifc:Op>
                    <ifc:Op>d</ifc:Op>
                    <ifc:Op>f</ifc:Op>
                    <ifc:Op>a</ifc:Op>
                    <ifc:Op>m</ifc:Op>
                </ifc:PassiveIFOPS>
            </ifc:TargetObject>
            <ifc:TargetObject>
                <ifc:Name>com.sun.max.vm.hosted.HostedClassLoader</ifc:Name>
                <ifc:ID>1</ifc:ID>
                <ifc:SecurityLevel>F</ifc:SecurityLevel>
                <ifc:Category>S</ifc:Category>
                <ifc:Type>T</ifc:Type>
                <ifc:ActiveIFOPS>
                    <ifc:Op>e</ifc:Op>
                    <ifc:Op>o</ifc:Op>
                    <ifc:Op>c</ifc:Op>
                    <ifc:Op>l</ifc:Op>
                    <ifc:Op>w</ifc:Op>
                    <ifc:Op>r</ifc:Op>
                    <ifc:Op>d</ifc:Op>
                    <ifc:Op>f</ifc:Op>
                    <ifc:Op>a</ifc:Op>
                    <ifc:Op>m</ifc:Op>
                </ifc:ActiveIFOPS>
                <ifc:PassiveIFOPS>
                    <ifc:Op>e</ifc:Op>
                    <ifc:Op>o</ifc:Op>
                    <ifc:Op>c</ifc:Op>
                    <ifc:Op>l</ifc:Op>
                    <ifc:Op>w</ifc:Op>
                    <ifc:Op>r</ifc:Op>
                    <ifc:Op>d</ifc:Op>
                    <ifc:Op>f</ifc:Op>
                    <ifc:Op>a</ifc:Op>
                    <ifc:Op>m</ifc:Op>
                </ifc:PassiveIFOPS>
            </ifc:TargetObject>
            <ifc:TargetObject>
                <ifc:Name>test.output.HelloWorld</ifc:Name>
                <ifc:ID>2</ifc:ID>
                <ifc:SecurityLevel>F</ifc:SecurityLevel>
                <ifc:Category>A</ifc:Category>
                <ifc:Type>I</ifc:Type>
                <ifc:ActiveIFOPS/>
                <ifc:PassiveIFOPS>
                    <ifc:Op>e</ifc:Op>
                    <ifc:Op>o</ifc:Op>
                    <ifc:Op>c</ifc:Op>
                    <ifc:Op>l</ifc:Op>
                    <ifc:Op>w</ifc:Op>
                    <ifc:Op>r</ifc:Op>
                    <ifc:Op>d</ifc:Op>
                    <ifc:Op>f</ifc:Op>
                    <ifc:Op>a</ifc:Op>
                    <ifc:Op>m</ifc:Op>
                </ifc:PassiveIFOPS>
            </ifc:TargetObject>
            <ifc:TargetObject>
                <ifc:Name>java.lang.System</ifc:Name>
                <ifc:ID>3</ifc:ID>
                <ifc:SecurityLevel>F</ifc:SecurityLevel>
                <ifc:Category>S</ifc:Category>
                <ifc:Type>I</ifc:Type>
                <ifc:ActiveIFOPS/>
                <ifc:PassiveIFOPS>
                    <ifc:Op>e</ifc:Op>
                    <ifc:Op>o</ifc:Op>
                    <ifc:Op>c</ifc:Op>
                    <ifc:Op>l</ifc:Op>
                    <ifc:Op>w</ifc:Op>
                    <ifc:Op>r</ifc:Op>
                    <ifc:Op>d</ifc:Op>
                    <ifc:Op>f</ifc:Op>
                    <ifc:Op>a</ifc:Op>
                    <ifc:Op>m</ifc:Op>
                </ifc:PassiveIFOPS>
            </ifc:TargetObject>
        </ifc:TargetObjects>
    </ifc:IFCObjects>
</ifc:IFCPolicy>
