<?xml version="1.0" encoding="UTF-8" ?>
<ifc:IFCPolicy xmlns:xsi="http://www.w3.org/2001/XMLSchema-instance"
               xsi:schemaLocation="http://ifcparaclete.org                 file:/Users/GripGlebe/jdeveloper/mywork/IFCParaclete/IFCDissertationCode/src/org/ifcparaclete/ IFCPolicy.xsd"
               xmlns:ifc="http://ifcparaclete.org">
    <ifc:RunnableObject>
        <ifc:Name>com.sun.max.asm.dis.Disassembler</ifc:Name>
        <ifc:ID>0</ifc:ID>
        <ifc:SecurityLevel>F</ifc:SecurityLevel>
        <ifc:Category>A</ifc:Category>
        <ifc:Type>I</ifc:Type>
        <ifc:ActiveIFOPS></ifc:ActiveIFOPS>
        <ifc:Op>e</ifc:Op>
        <ifc:Op>o</ifc:Op>
        <ifc:Op>c</ifc:Op>
        <ifc:Op>l</ifc:Op>
        <ifc:Op>w</ifc:Op>
        <ifc:Op>r</ifc:Op>
        <ifc:Op>d</ifc:Op>
        <ifc:Op>f</ifc:Op>
        <ifc:PassiveIFOPS>
            <ifc:Op>e</ifc:Op>
            <ifc:Op>o</ifc:Op>
            <ifc:Op>c</ifc:Op>
            <ifc:Op>l</ifc:Op>
            <ifc:Op>w</ifc:Op>
            <ifc:Op>r</ifc:Op>
            <ifc:Op>d</ifc:Op>
            <ifc:Op>f</ifc:Op>
        </ifc:PassiveIFOPS>
    </ifc:RunnableObject>
    <ifc:RunnableObject>
        <ifc:Name>test.output.HelloWorld</ifc:Name>
        <ifc:ID>1</ifc:ID>
        <ifc:SecurityLevel>F</ifc:SecurityLevel>
        <ifc:Category>A</ifc:Category>
        <ifc:Type>I</ifc:Type>
        <ifc:ActiveIFOPS/>
        <ifc:PassiveIFOPS>
            <ifc:Op>e</ifc:Op>
            <ifc:Op>o</ifc:Op>
            <ifc:Op>c</ifc:Op>
            <ifc:Op>l</ifc:Op>
            <ifc:Op>w</ifc:Op>
            <ifc:Op>r</ifc:Op>
            <ifc:Op>d</ifc:Op>
            <ifc:Op>f</ifc:Op>
        </ifc:PassiveIFOPS>
    </ifc:RunnableObject>
    <ifc:RunnableObject>
        <ifc:Name>HelloWorld</ifc:Name>
        <ifc:ID>2</ifc:ID>
        <ifc:SecurityLevel>F</ifc:SecurityLevel>
        <ifc:Category>A</ifc:Category>
        <ifc:Type>I</ifc:Type>
        <ifc:ActiveIFOPS/>
        <ifc:PassiveIFOPS>
            <ifc:Op>e</ifc:Op>
            <ifc:Op>o</ifc:Op>
            <ifc:Op>c</ifc:Op>
            <ifc:Op>l</ifc:Op>
            <ifc:Op>w</ifc:Op>
            <ifc:Op>r</ifc:Op>
            <ifc:Op>d</ifc:Op>
            <ifc:Op>f</ifc:Op>
        </ifc:PassiveIFOPS>
    </ifc:RunnableObject>
    <ifc:RunnableObject>
        <ifc:Name>IFCTesting.HelloWorld</ifc:Name>
        <ifc:ID>3</ifc:ID>
        <ifc:SecurityLevel>F</ifc:SecurityLevel>
        <ifc:Category>A</ifc:Category>
        <ifc:Type>I</ifc:Type>
        <ifc:ActiveIFOPS/>
        <ifc:PassiveIFOPS>
            <ifc:Op>e</ifc:Op>
            <ifc:Op>o</ifc:Op>
            <ifc:Op>c</ifc:Op>
            <ifc:Op>l</ifc:Op>
            <ifc:Op>w</ifc:Op>
            <ifc:Op>r</ifc:Op>
            <ifc:Op>d</ifc:Op>
            <ifc:Op>f</ifc:Op>
        </ifc:PassiveIFOPS>
    </ifc:RunnableObject>
    <ifc:RunnableObject>
        <ifc:Name>IFCTest_1</ifc:Name>
        <ifc:ID>4</ifc:ID>
        <ifc:SecurityLevel>U</ifc:SecurityLevel>
        <ifc:Category>A</ifc:Category>
        <ifc:Type>I</ifc:Type>
        <ifc:ActiveIFOPS></ifc:ActiveIFOPS>
        <ifc:PassiveIFOPS>
            <ifc:Op>e</ifc:Op>
            <ifc:Op>o</ifc:Op>
            <ifc:Op>c</ifc:Op>
            <ifc:Op>l</ifc:Op>
            <ifc:Op>w</ifc:Op>
            <ifc:Op>r</ifc:Op>
            <ifc:Op>d</ifc:Op>
            <ifc:Op>f</ifc:Op>
        </ifc:PassiveIFOPS>
    </ifc:RunnableObject>
    <ifc:RunnableObject>
        <ifc:Name>IFCTest_2</ifc:Name>
        <ifc:ID>5</ifc:ID>
        <ifc:SecurityLevel>P</ifc:SecurityLevel>
        <ifc:Category>A</ifc:Category>
        <ifc:Type>I</ifc:Type>
        <ifc:ActiveIFOPS/>
        <ifc:PassiveIFOPS>
            <ifc:Op>e</ifc:Op>
            <ifc:Op>o</ifc:Op>
            <ifc:Op>c</ifc:Op>
            <ifc:Op>l</ifc:Op>
            <ifc:Op>w</ifc:Op>
            <ifc:Op>r</ifc:Op>
            <ifc:Op>d</ifc:Op>
            <ifc:Op>f</ifc:Op>
        </ifc:PassiveIFOPS>
    </ifc:RunnableObject>
    <ifc:RunnableObject>
        <ifc:Name>IFCTest_3</ifc:Name>
        <ifc:ID>6</ifc:ID>
        <ifc:SecurityLevel>H</ifc:SecurityLevel>
        <ifc:Category>A</ifc:Category>
        <ifc:Type>I</ifc:Type>
        <ifc:ActiveIFOPS/>
        <ifc:PassiveIFOPS>
            <ifc:Op>e</ifc:Op>
            <ifc:Op>o</ifc:Op>
            <ifc:Op>c</ifc:Op>
            <ifc:Op>l</ifc:Op>
            <ifc:Op>w</ifc:Op>
            <ifc:Op>r</ifc:Op>
            <ifc:Op>d</ifc:Op>
            <ifc:Op>f</ifc:Op>
        </ifc:PassiveIFOPS>
    </ifc:RunnableObject>
    <ifc:RunnableObject>
        <ifc:Name>IFCTest_4</ifc:Name>
        <ifc:ID>7</ifc:ID>
        <ifc:SecurityLevel>F</ifc:SecurityLevel>
        <ifc:Category>A</ifc:Category>
        <ifc:Type>I</ifc:Type>
        <ifc:ActiveIFOPS/>
        <ifc:PassiveIFOPS>
            <ifc:Op>e</ifc:Op>
            <ifc:Op>o</ifc:Op>
            <ifc:Op>c</ifc:Op>
            <ifc:Op>l</ifc:Op>
            <ifc:Op>w</ifc:Op>
            <ifc:Op>r</ifc:Op>
            <ifc:Op>d</ifc:Op>
            <ifc:Op>f</ifc:Op>
        </ifc:PassiveIFOPS>
    </ifc:RunnableObject>
</ifc:IFCPolicy>
